<?xml version="1.0" encoding="utf-8" ?>
<!--Created with Liquid XML Studio - FREE Community Edition 7.0.2.746 (http://www.liquid-technologies.com)-->
<xs:schema elementFormDefault="qualified" xmlns:xs="http://www.w3.org/2001/XMLSchema">
  <xs:complexType name="vector">
    <xs:annotation>
      <xs:documentation>This is a documentation line.</xs:documentation>
    </xs:annotation>
    <xs:attribute name="x" type="xs:double" use="required" />
    <xs:attribute name="y" type="xs:double" use="required" />
    <xs:attribute name="z" type="xs:double" use="required" />
  </xs:complexType>
  <xs:complexType name="orientation">
    <xs:choice minOccurs="1" maxOccurs="1">
      <xs:element name="euler_angles">
        <xs:complexType>
          <xs:attribute name="alpha" use="required">
            <xs:simpleType>
              <xs:restriction base="xs:double">
                <xs:minInclusive value="0" />
              </xs:restriction>
            </xs:simpleType>
          </xs:attribute>
          <xs:attribute name="beta" use="required">
            <xs:simpleType>
              <xs:restriction base="xs:double">
                <xs:minInclusive value="0" />
              </xs:restriction>
            </xs:simpleType>
          </xs:attribute>
          <xs:attribute name="gamma" use="required">
            <xs:simpleType>
              <xs:restriction base="xs:double">
                <xs:minInclusive value="0" />
              </xs:restriction>
            </xs:simpleType>
          </xs:attribute>
        </xs:complexType>
      </xs:element>
      <xs:element name="angle_axis">
        <xs:complexType>
          <xs:sequence>
            <xs:element name="angle">
              <xs:simpleType>
                <xs:restriction base="xs:double">
                  <xs:minInclusive value="0" />
                  <xs:maxInclusive value="6.2831853071795862" />
                </xs:restriction>
              </xs:simpleType>
            </xs:element>
            <xs:element name="axis" type="vector" />
          </xs:sequence>
        </xs:complexType>
      </xs:element>
      <xs:element name="quaternion">
        <xs:complexType>
          <xs:attribute name="re" type="xs:double" use="required" />
          <xs:attribute name="i" type="xs:double" use="required" />
          <xs:attribute name="j" type="xs:double" use="required" />
          <xs:attribute name="k" type="xs:double" use="required" />
        </xs:complexType>
      </xs:element>
      <xs:element name="eigensystem">
        <xs:complexType>
          <xs:sequence>
            <xs:element minOccurs="1" maxOccurs="1" name="x_axis" type="vector" />
            <xs:element minOccurs="1" maxOccurs="1" name="y_axis" type="vector" />
            <xs:element minOccurs="1" maxOccurs="1" name="z_axis" type="vector" />
          </xs:sequence>
        </xs:complexType>
      </xs:element>
    </xs:choice>
  </xs:complexType>
  <xs:complexType name="interaction">
    <xs:choice minOccurs="1" maxOccurs="1">
      <xs:element name="scalar">
        <xs:complexType>
          <xs:simpleContent>
            <xs:extension base="xs:double">
              <xs:attribute name="strong" type="xs:boolean" />
            </xs:extension>
          </xs:simpleContent>
        </xs:complexType>
      </xs:element>
      <xs:element name="matrix">
        <xs:complexType>
          <xs:sequence>
            <xs:element minOccurs="9" maxOccurs="9" name="element" type="xs:double" />
          </xs:sequence>
        </xs:complexType>
      </xs:element>
      <xs:sequence>
        <xs:choice minOccurs="1" maxOccurs="1">
          <xs:element name="eigenvalues">
            <xs:complexType>
              <xs:attribute name="XX" type="xs:double" use="required" />
              <xs:attribute name="YY" type="xs:double" use="required" />
              <xs:attribute name="ZZ" type="xs:double" use="required" />
            </xs:complexType>
          </xs:element>
          <xs:element name="axiality_rhombicity">
            <xs:complexType>
              <xs:attribute name="iso" type="xs:double" use="required" />
              <xs:attribute name="ax" type="xs:double" use="required" />
              <xs:attribute name="rh" type="xs:double" use="required" />
            </xs:complexType>
          </xs:element>
          <xs:element name="span_skew">
            <xs:complexType>
              <xs:attribute name="iso" type="xs:double" />
              <xs:attribute name="ax" type="xs:double" />
              <xs:attribute name="rh" type="xs:double" />
            </xs:complexType>
          </xs:element>
        </xs:choice>
        <xs:element minOccurs="1" maxOccurs="1" name="orientation" type="orientation" />
      </xs:sequence>
    </xs:choice>
    <xs:attribute name="type" type="xs:string" use="required" />
    <xs:attribute name="units" type="xs:string" use="required" />
    <xs:attribute name="spin_1" use="required">
      <xs:simpleType>
        <xs:restriction base="xs:integer">
          <xs:minInclusive value="0" />
        </xs:restriction>
      </xs:simpleType>
    </xs:attribute>
    <xs:attribute name="spin_2">
      <xs:simpleType>
        <xs:restriction base="xs:integer">
          <xs:minInclusive value="0" />
        </xs:restriction>
      </xs:simpleType>
    </xs:attribute>
  </xs:complexType>
  <xs:element name="spin_system">
    <xs:complexType>
      <xs:sequence minOccurs="1" maxOccurs="1">
        <xs:element minOccurs="1" maxOccurs="unbounded" name="spin">
          <xs:complexType>
            <xs:sequence>
              <xs:element minOccurs="1" maxOccurs="1" name="coordinates" type="vector" />
            </xs:sequence>
            <xs:attribute name="number" use="required">
              <xs:simpleType>
                <xs:restriction base="xs:integer">
                  <xs:minInclusive value="0" />
                </xs:restriction>
              </xs:simpleType>
            </xs:attribute>
            <xs:attribute name="isotope" type="xs:string" use="required" />
            <xs:attribute name="label" type="xs:string" />
            <xs:attribute name="reference_frame" use="required">
              <xs:simpleType>
                <xs:restriction base="xs:integer">
                  <xs:minInclusive value="0" />
                </xs:restriction>
              </xs:simpleType>
            </xs:attribute>
          </xs:complexType>
        </xs:element>
        <xs:element minOccurs="1" maxOccurs="unbounded" name="interaction">
          <xs:complexType>
            <xs:complexContent mixed="false">
              <xs:extension base="interaction">
                <xs:attribute name="reference_frame" use="required">
                  <xs:simpleType>
                    <xs:restriction base="xs:integer">
                      <xs:minInclusive value="0" />
                    </xs:restriction>
                  </xs:simpleType>
                </xs:attribute>
              </xs:extension>
            </xs:complexContent>
          </xs:complexType>
        </xs:element>
        <xs:element minOccurs="0" maxOccurs="unbounded" name="reference_frame">
          <xs:complexType>
            <xs:sequence>
              <xs:element name="origin" type="vector" />
              <xs:element name="orientation" type="orientation" />
            </xs:sequence>
            <xs:attribute name="number" use="required">
              <xs:simpleType>
                <xs:restriction base="xs:integer">
                  <xs:minInclusive value="0" />
                </xs:restriction>
              </xs:simpleType>
            </xs:attribute>
            <xs:attribute name="label" type="xs:string" use="optional" />
            <xs:attribute name="reference_frame" use="optional">
              <xs:simpleType>
                <xs:restriction base="xs:integer">
                  <xs:minInclusive value="0" />
                </xs:restriction>
              </xs:simpleType>
            </xs:attribute>
          </xs:complexType>
        </xs:element>
      </xs:sequence>
    </xs:complexType>
  </xs:element>
</xs:schema>